question,answer,retrieved_sources
How should a student use validation and test splits correctly?,"The correct pattern is train on train, choose by validation, and evaluate on test only once at the end. The correct pattern is train on train, choose by validation, and evaluate on test only once at the end.",doc_03_validation_policy; doc_03_validation_policy; doc_03_validation_policy
What does hit@k mean in retrieval evaluation?,"The notebook should demonstrate chunking, vectorization, a FAISS index, retrieval evaluation, knowledge base update, and a mini-RAG answer with sources. A compact educational retrieval project does not require a production database, reranking stack, or a large language model service.",upd_03_hw14_specific_note; doc_12_practical_limits; doc_07_retrieval_metrics
Why can chunk size harm retrieval quality?,"After an update, retrieval quality can change because new fragments may satisfy queries that previously had weak or missing support. If retrieval fails, the answer quality usually fails as well because the generator has no relevant evidence.",doc_08_knowledge_base_updates; doc_06_faiss_notes; doc_09_mini_rag
What is the purpose of updating a knowledge base?,"Updating a knowledge base means adding new documents or refreshing existing ones and then rebuilding the index. Reports should explicitly name the selected dataset or knowledge base, the chosen model or vectorizer, and the key configuration values.",doc_08_knowledge_base_updates; doc_11_reports_and_artifacts; doc_08_knowledge_base_updates
What files are required specifically for HW14 after the update?,"For HW14 the required artifacts are retrieval_eval.csv, rag_examples.csv, and retrieval_before_after_update.csv. A homework submission is considered complete only when the repository contains the required files with exact names.",upd_03_hw14_specific_note; doc_02_submission_rules; doc_11_reports_and_artifacts
